{
  "bundle_format": 1,
  "view": "document_bundle",
  "contract": {
    "schema_name": "breeding-literature-record",
    "schema_version": "3.8.0"
  },
  "documents": [
    {
      "source_id": "doi:10.1007/fict.2021.0000",
      "document": {
        "common.source_id": "doi:10.1007/fict.2021.0000",
        "common.source_type": "paper",
        "common.source_title": "Genome-Wide Association Study Identifies a Stable QTL qPH3 for Plant Height and Its Potential in Yield Breeding in Rice",
        "common.source_doi": "10.1007/fict.2021.0000",
        "common.source_year": 2021,
        "common.source_authors": [
          "Zhang Lei",
          "Wang Fang"
        ],
        "common.source_language": "en",
        "common.crop_name": "籼稻",
        "common.species_name": "Oryza sativa subsp. indica",
        "common.population_name": "448-core-indica",
        "common.source_record_id": "example-ric-gwas-ph-yield-2026",
        "common.source_uri": "https://doi.org/10.1007/fict.2021.0000",
        "common.source_document_type": "journal_paper",
        "common.source_journal": "Theoretical and Applied Genetics (fictional)",
        "common.source_volume": "134",
        "common.source_issue": "7",
        "common.source_page_range": "2221-2235",
        "common.source_abstract": "We performed a genome-wide association study of plant height and grain yield in a panel of 448 indica rice accessions across three environments, identifying the stable major QTL qPH3 ...",
        "common.source_keywords": [
          "GWAS",
          "plant height",
          "qPH3",
          "grain yield",
          "Oryza sativa",
          "marker-assisted selection"
        ],
        "common.source_funding": [
          "NK2021A02 (Jiangsu Modern Agriculture Project)",
          "NSFC-32172010"
        ],
        "common.source_affiliations": [
          "Jiangsu Academy of Agricultural Sciences",
          "Nanjing Agricultural University"
        ]
      },
      "counts": {
        "records": 13,
        "by_record_kind": {
          "analysis_result": 4,
          "claim": 4,
          "observation": 5
        }
      },
      "records_by_kind": {
        "analysis_result": [
          "rec_f1af759495e747935362c387e63a43f6",
          "rec_527d93aac600e9dfe681c116976391bf",
          "rec_da4ecc4c9528f5f156e7206fbb0c4514",
          "rec_ab154cb53029d9d7b9b554bc002e6167"
        ],
        "claim": [
          "rec_03724b4d838a204c72b9f6eb79f97596",
          "rec_19e2a000b39a59888c5cd69ee1002d28",
          "rec_4909b279c2b61b6bbf2b9059c9d33759",
          "rec_ad52c95e493d7c0cdfa09a704d4529bc"
        ],
        "observation": [
          "rec_8d3a8dec750cadc5787e9afc7490d09a",
          "rec_bf1e503d911c5877608db904c5067017",
          "rec_7fefdada2f8350012f4bc983ebe40815",
          "rec_47bcb48ca6c4c634554c2f972b5dedfd",
          "rec_ecd1abda719f008663e31ba49689b164"
        ]
      },
      "entities": {
        "crop_name": [
          "籼稻"
        ],
        "species_name": [
          "Oryza sativa subsp. indica"
        ],
        "trait_names": [
          "Plant height",
          "Grain yield per plant"
        ],
        "gene_names": [
          "sd1",
          "Os03g0229400"
        ],
        "qtl_names": [
          "qPH3"
        ],
        "population_name": [
          "448-core-indica"
        ],
        "marker_names": [
          "SNP3_17300000"
        ]
      },
      "evidence_index": [
        {
          "page": 3,
          "quote": "GY (g) after air drying",
          "record_ids": [
            "rec_ab154cb53029d9d7b9b554bc002e6167",
            "rec_ecd1abda719f008663e31ba49689b164"
          ]
        },
        {
          "page": 3,
          "quote": "PH (cm) measured at maturity",
          "record_ids": [
            "rec_da4ecc4c9528f5f156e7206fbb0c4514",
            "rec_47bcb48ca6c4c634554c2f972b5dedfd"
          ]
        },
        {
          "page": 3,
          "quote": "genotyping with 54K chip covering sd1 region",
          "record_ids": [
            "rec_bf1e503d911c5877608db904c5067017"
          ]
        },
        {
          "page": 7,
          "quote": "qPH3 stable across E1E2E3",
          "record_ids": [
            "rec_8d3a8dec750cadc5787e9afc7490d09a",
            "rec_f1af759495e747935362c387e63a43f6",
            "rec_527d93aac600e9dfe681c116976391bf"
          ]
        },
        {
          "page": 7,
          "section": "结果",
          "quote": "qPH3 stable across E1E2E3",
          "record_ids": [
            "rec_19e2a000b39a59888c5cd69ee1002d28",
            "rec_4909b279c2b61b6bbf2b9059c9d33759"
          ]
        },
        {
          "page": 9,
          "section": "结果",
          "quote": "sd1 allele reduces PH by 15-25 cm",
          "record_ids": [
            "rec_03724b4d838a204c72b9f6eb79f97596",
            "rec_ad52c95e493d7c0cdfa09a704d4529bc"
          ]
        },
        {
          "page": 14,
          "quote": "candidate genes in qPH3 interval",
          "record_ids": [
            "rec_7fefdada2f8350012f4bc983ebe40815"
          ]
        }
      ],
      "records": [
        {
          "common": {
            "source_title": "Genome-Wide Association Study Identifies a Stable QTL qPH3 for Plant Height and Its Potential in Yield Breeding in Rice",
            "source_doi": "10.1007/fict.2021.0000",
            "source_year": 2021,
            "source_authors": [
              "Zhang Lei",
              "Wang Fang"
            ],
            "source_affiliations": [
              "Jiangsu Academy of Agricultural Sciences",
              "Nanjing Agricultural University"
            ],
            "source_journal": "Theoretical and Applied Genetics (fictional)",
            "source_volume": "134",
            "source_issue": "7",
            "source_page_range": "2221-2235",
            "source_abstract": "We performed a genome-wide association study of plant height and grain yield in a panel of 448 indica rice accessions across three environments, identifying the stable major QTL qPH3 ...",
            "source_keywords": [
              "GWAS",
              "plant height",
              "qPH3",
              "grain yield",
              "Oryza sativa",
              "marker-assisted selection"
            ],
            "source_funding": [
              "NK2021A02 (Jiangsu Modern Agriculture Project)",
              "NSFC-32172010"
            ],
            "source_language": "en",
            "source_document_type": "journal_paper",
            "source_type": "paper",
            "species_name": "Oryza sativa subsp. indica",
            "crop_name": "籼稻",
            "source_id": "doi:10.1007/fict.2021.0000",
            "source_uri": "https://doi.org/10.1007/fict.2021.0000",
            "source_record_id": "example-ric-gwas-ph-yield-2026",
            "extraction_method": "model",
            "source_page": 9,
            "source_quote": "sd1 allele reduces PH by 15-25 cm",
            "source_section": "结果",
            "gene_names": [
              "sd1"
            ],
            "trait_names": [
              "Plant height"
            ],
            "record_id": "rec_03724b4d838a204c72b9f6eb79f97596",
            "schema_name": "breeding-literature-record",
            "schema_version": "3.8.0",
            "record_kind": "claim",
            "record_grain": "evidence_unit",
            "source_locator": "page=9;section=结果",
            "review_status": "pending_review",
            "record_version": 1,
            "extraction_run_id": "mig_20260921T141320Z_bbfa7e12",
            "qc_rule_set_version": "breeding-literature-record@3.8.0+legacy-migration@1.0.0",
            "qc_failure_codes": [
              "LEGACY_MIGRATED",
              "LEGACY_QUOTE_UNVERIFIED",
              "LEGACY_SECTION_REF_DANGLING"
            ]
          },
          "transform": {
            "subject_mention": "sd1",
            "object_mention": "Plant height"
          },
          "agent": {
            "validation_methods": [
              "基因编辑验证",
              "表达分析"
            ]
          }
        },
        {
          "common": {
            "source_title": "Genome-Wide Association Study Identifies a Stable QTL qPH3 for Plant Height and Its Potential in Yield Breeding in Rice",
            "source_doi": "10.1007/fict.2021.0000",
            "source_year": 2021,
            "source_authors": [
              "Zhang Lei",
              "Wang Fang"
            ],
            "source_affiliations": [
              "Jiangsu Academy of Agricultural Sciences",
              "Nanjing Agricultural University"
            ],
            "source_journal": "Theoretical and Applied Genetics (fictional)",
            "source_volume": "134",
            "source_issue": "7",
            "source_page_range": "2221-2235",
            "source_abstract": "We performed a genome-wide association study of plant height and grain yield in a panel of 448 indica rice accessions across three environments, identifying the stable major QTL qPH3 ...",
            "source_keywords": [
              "GWAS",
              "plant height",
              "qPH3",
              "grain yield",
              "Oryza sativa",
              "marker-assisted selection"
            ],
            "source_funding": [
              "NK2021A02 (Jiangsu Modern Agriculture Project)",
              "NSFC-32172010"
            ],
            "source_language": "en",
            "source_document_type": "journal_paper",
            "source_type": "paper",
            "species_name": "Oryza sativa subsp. indica",
            "crop_name": "籼稻",
            "source_id": "doi:10.1007/fict.2021.0000",
            "source_uri": "https://doi.org/10.1007/fict.2021.0000",
            "source_record_id": "example-ric-gwas-ph-yield-2026",
            "extraction_method": "model",
            "source_page": 7,
            "source_quote": "qPH3 stable across E1E2E3",